{
  "schema_version": "1.0.0",
  "validation_run_id": "VAL-2026-009",
  "detection_id": "DET-2026-009",
  "scenario_id": "PT-2026-009",
  "technique_id": "T1546.013",
  "status": "historical-live-validated",
  "validation_environment": {
    "target_role": "authorized lab endpoint",
    "siem_role": "internal SIEM service",
    "sanitized": true
  },
  "validated_at": "2026-07-18T20:00:22.115522Z",
  "source_record_sha256": "709bf753a9ac6d75f19922709b6bf42436ff65200c19ccb8fbdf22273ef7d49d",
  "positive_test": {
    "detection_fired": true,
    "marker_found": null,
    "latency_seconds": null,
    "latency_status": "uncomputed"
  },
  "variant_test": {
    "detection_fired": true,
    "marker_found": null,
    "latency_seconds": null,
    "latency_status": "uncomputed"
  },
  "negative_tests": [
    {
      "ordinal": 1,
      "detection_fired": false,
      "expected_quiet": true
    },
    {
      "ordinal": 2,
      "detection_fired": false,
      "expected_quiet": true
    },
    {
      "ordinal": 3,
      "detection_fired": false,
      "expected_quiet": true
    }
  ],
  "cleanup": {
    "status": "confirmed",
    "confirmed_at": "2026-07-18T20:01:05.451400Z"
  },
  "limitations": [
    "Historical authorized-lab result; current telemetry and deployment state require a fresh preflight.",
    "Raw logs, commands, host identifiers, user identifiers, event identifiers, and environment-specific values are intentionally excluded.",
    "Successful detection does not prove portability to other field mappings, indexes, tables, sourcetypes, or data models."
  ]
}